numero_identificador,data_atualizacao,tipo,titulo,ano,pais,evento,cidade,periodico,editora,descricao,autores,Qualis
1770068905157044,30052024,Artigo Publicado,Influence of the milling conditions on the thermal decomposition of Bayer gibbsite,2020.0,,,,POWDER TECHNOLOGY,,,"RIVAS-MERCURY, J.M. (RIVAS-MERCURY, J.M.), SUCUPIRA, J.R.M. (SUCUPIRA, J.R.M.), RODRÍGUEZ, M.A. (RODRÍGUEZ, M.A.), Aluísio Alves Cabral Júnior (Cabral, A.A.), DE AZA, A.H. (DE AZA, A.H.), PENA, P. (PENA, P.)",B3
1770068905157044,30052024,Artigo Publicado,"Structure, Glass Stability and Crystallization Activation Energy of SrO-CaO-B2O3-SiO2 glasses doped with TiO2",2021.0,,,,JOURNAL OF NON-CRYSTALLINE SOLIDS,,,"ALENCAR, MARIA V.S. (ALENCAR, MARIA V.S.), BEZERRA, GLAUCO V.P. (BEZERRA, GLAUCO V.P.), SILVA, LAÍS D. (SILVA, LAÍS D.), SCHNEIDER, JOSÉ F. (SCHNEIDER, JOSÉ F.), PASCUAL, M. JESUS (PASCUAL, M. JESUS), Aluísio Alves Cabral Júnior (Cabral, Aluísio A.)",C
1770068905157044,30052024,Artigo Publicado,Model-free and model-fitting analysis applied to the non-isothermal crystallization kinetics of a SrO-CaO-B2O3-TiO2-SiO2 glass sealant for SOFCs,2021.0,,,,JOURNAL OF NON-CRYSTALLINE SOLIDS,,,"BEZERRA, GLAUCO V.P. (BEZERRA, GLAUCO V.P.), Aluísio Alves Cabral Júnior (Cabral, Aluísio A.)",C
1770068905157044,30052024,Artigo Publicado,New Clayey Deposit and Their Potential as Raw Material for Red or Structured Ceramics: Technological Characterization,2021.0,,,,Materials,,,"ASSUNÇÃO, ANA ROSA S. (ASSUNÇÃO, ANA ROSA S.), RIVAS-MERCURY, JOSÉ MANUEL (RIVAS-MERCURY, JOSÉ MANUEL), CORREIA, GRICIRENE SOUSA (CORREIA, GRICIRENE SOUSA), VASCONCELOS, NAZARÉ DO SOCORRO L. S. (VASCONCELOS, NAZARÉ DO SOCORRO L. S.), Aluísio Alves Cabral Júnior (Cabral, Aluísio Alves), ANGÉLICA, RÔMULO SIMÕES (ANGÉLICA, RÔMULO SIMÕES), DA COSTA, FABIANA PEREIRA (DA COSTA, FABIANA PEREIRA), MENEZES, ROMUALDO RODRIGUES (MENEZES, ROMUALDO RODRIGUES), DE ARAÚJO NEVES, GELMIRES (DE ARAÚJO NEVES, GELMIRES), RODRIGUES, ALISSON MENDES (RODRIGUES, ALISSON MENDES)",A1
1770068905157044,30052024,Artigo Publicado,Discoveries about the structure of alkaline earth-bearing borosilicate glasses doped with TiO2 revealed by Raman spectroscopy,2022.0,,,,JOURNAL OF NON-CRYSTALLINE SOLIDS,,,"ARTUR GOES SANTOS (SANTOS, A. G.), BENJAMIM J.A. MOULTON (MOULTON, B. J.), Aluísio Alves Cabral Júnior (Cabral, Aluisio A.)",C
1770068905157044,30052024,Artigo Publicado,Oxidação com Persulfato de Amônio da Biomassa Lignocelulósica e da Biomassa de açaí para a Extração da Nanocristais de Celulose: Estado da arte,2022.0,,,,REVISTA ION,,,"ANA PAULA COELHO DA COSTA (COSTA, A. P. C.), Lamia Zuniga Linan (LINAN, L. Z.), Anne Carolyne Mendonça Cidreira (CIDREIRA, A. C. M.), TAHMASB HATAMI (HATAMI, T.), Aluísio Alves Cabral Júnior (Cabral, A.A.), RAYAN CUTRIM GOMES (GOMES, R. C.), JACIENE JESUS CARDOSO ROCHA (ROCHA, J. J. C.)",A3
1770068905157044,30052024,Artigo Publicado,Anomalous Avrami index recorded during the non-isothermal crystallization of borotitanosilicate glass powders,2023.0,,,,JOURNAL OF NON-CRYSTALLINE SOLIDS,,,"BEZERRA, GLAUCO V.P. (BEZERRA, GLAUCO V.P.), ALENCAR, MARIA V.S. (ALENCAR, MARIA V.S.), CROVACE, MURILO C. (CROVACE, MURILO C.), Rodrigues, Alisson M. (Rodrigues, Alisson M.), Aluísio Alves Cabral Júnior (Cabral, Aluísio A.)",C
1770068905157044,30052024,Artigo Publicado,Effect of the substitution of MgO with CaO on the structural and thermal properties of CaO-SrO-B2O3-SiO2 glass and glass-ceramics containing excess TiO2,2023.0,,,,CERAMICS INTERNATIONAL,,,"RODRIGUES, KAMYLA C. (RODRIGUES, KAMYLA C.), SERBENA, FRANCISCO C. (SERBENA, FRANCISCO C.), SCHNEIDER, JOSÉ F. (SCHNEIDER, JOSÉ F.), PASCUAL, MARIA J. (PASCUAL, MARIA J.), Aluísio Alves Cabral Júnior (Cabral, Aluísio A.)",B1
1770068905157044,30052024,Artigo Publicado,KLaF4:Nd3+doped transparent glass-ceramics processed by spark plasma sintering,2021.0,,,,JOURNAL OF NON-CRYSTALLINE SOLIDS,,,"BABU, S. (BABU, S.), BALDA, R. (BALDA, R.), FERNÁNDEZ, J. (FERNÁNDEZ, J.), SEDANO, M. (SEDANO, M.), GORNI, G. (GORNI, G.), Aluísio Alves Cabral Júnior (Cabral, A.A.), GALUSEK, D. (GALUSEK, D.), DURÁN, A. (DURÁN, A.), PASCUAL, M.J. (PASCUAL, M.J.)",C
1770068905157044,30052024,Artigo Publicado,Effect of the milling conditions on the decomposition kinetics of gibbsite,2023.0,,,,BOLETIN DE LA SOCIEDAD ESPANOLA DE CERAMICA Y VIDRIO,,,"Aluísio Alves Cabral Júnior (Cabral, A.A.), Mercury, J.M.R. (Mercury, J.M.R.), SUCUPIRA, J.R.M. (SUCUPIRA, J.R.M.), RODRÍGUEZ, M.A. (RODRÍGUEZ, M.A.), ANTONIO H. DE AZA (AZA, A. H.), ELENA MOUKHINA (MOUKHINA, E.)",A3
1770068905157044,30052024,Artigo Publicado,Synthesis of delafossite CuCrO2 via solution combustion method and its acid functionalization for biodiesel production,2023.0,,,,CERÂMICA,,,"M.C. VIEGAS (VIEGAS, M.), GILVAN PEREIRA DE FIGUEREDO (FIGUEREDO, G. P.), SAMUEL FILGUEIRAS RODRIGUES (RODRIGUES, S. F.), Aluísio Alves Cabral Júnior (Cabral, A.A.), MARIO A. M. CASTRO (CASTRO, M. A. M.), Marcelo Moizinho Oliveira (OLIVEIRA, M. M.)",A1
1770068905157044,30052024,Artigo Publicado,Acid-based organosolv lignin extraction from acai berry bagasse,2023.0,,,,Bioresource Technology Reports,,,"LINAN, LAMIA ZUNIGA (LINAN, LAMIA ZUNIGA), GONÇALVES, MELLANY PAULA XAVIER (GONÇALVES, MELLANY PAULA XAVIER), CIDREIRA, ANNE CAROLYNE MENDONÇA (CIDREIRA, ANNE CAROLYNE MENDONÇA), HATAMI, TAHMASB (HATAMI, TAHMASB), Aluísio Alves Cabral Júnior (JUNIOR, ALUISIO ALVES CABRAL), MEI, LUCIA HELENA INOCENTINNI (MEI, LUCIA HELENA INOCENTINNI)",B2
1770068905157044,30052024,Artigo Publicado,Biotechnological investigation of Pediastrum boryanum and Desmodesmus subspicatus microalgae species for a potential application in bioenergy,2023.0,,,,Algal Research-Biomass Biofuels and Bioproducts,,,"JACINTO, GISLAYNE SANTANA SANTOS (JACINTO, GISLAYNE SANTANA SANTOS), CRUZ, GLAUBER (CRUZ, GLAUBER), Aluísio Alves Cabral Júnior (Cabral, Aluísio Alves), BEZERRA, GLAUCO VINICIUS PALHANO (BEZERRA, GLAUCO VINICIUS PALHANO), PEÑA GARCIA, RAMÓN R. (PEÑA GARCIA, RAMÓN R.), MAGALHÃES, ULISSES NASCIMENTO (MAGALHÃES, ULISSES NASCIMENTO), GOMES, WOLIA COSTA (GOMES, WOLIA COSTA)",A4
1770068905157044,30052024,Artigo Publicado,"Buriti (Mauritia flexuosa L.) wastes as potential lignocellulosic feedstock for bioenergy production: Physicochemical properties, thermal behavior, and emission factors",2023.0,,,,INDUSTRIAL CROPS AND PRODUCTS,,,"DA SILVA, JULIE BRENDA SANTOS (DA SILVA, JULIE BRENDA SANTOS), Aluísio Alves Cabral Júnior (Cabral, Aluísio Alves), BEZERRA, GLAUCO VINICIUS PALHANO (BEZERRA, GLAUCO VINICIUS PALHANO), DA CRUZ, NILSON CRISTINO (DA CRUZ, NILSON CRISTINO), CONCONI, CHARLES CORREIA (CONCONI, CHARLES CORREIA), CRUZ, GLAUBER (CRUZ, GLAUBER)",B3
1770068905157044,30052024,Artigo Publicado,Crystallization kinetics in a lithium disilicate glass revisited: Model-free and model-fitting approaches,2023.0,,,,JOURNAL OF NON-CRYSTALLINE SOLIDS,,,"BEZERRA, GLAUCO V.P. (BEZERRA, GLAUCO V.P.), EVERTON, LEYLIANE S. (EVERTON, LEYLIANE S.), COSTA, ALBERTH M.C. (COSTA, ALBERTH M.C.), ROJAS, ALEX (ROJAS, ALEX), Rodrigues, Alisson M. (Rodrigues, Alisson M.), Aluísio Alves Cabral Júnior (Cabral, Aluisio A.)",C
5967561730464803,10052024,Artigo Publicado,Modelling Propagating Bloch Waves in Magnetoelectroelastic Phononic Structures with Kagomé Lattice Using the Improved Plane Wave Expansion,2020.0,,,,Crystals,,,"MIRANDA JR., EDSON JANSEN PEDROSA (MIRANDA JR., EDSON JANSEN PEDROSA), Samuel Filgueiras Rodrigues (RODRIGUES, S. F.), Clodualdo Aranas Júnior (ARANAS JUNIOR, C.), Hélio Vitor Cantanhêde da Silva (SILVA, H. V. C.), Eden Santos Silva (SILVA, E. S.), Gedeon Silva Reis (REIS, G. S.), Antonio Ernandes Macêdo Paiva (Paiva, A. E. M.), José Maria Campos dos Santos (SANTOS, J. M. C.)",A3
5967561730464803,10052024,Artigo Publicado,Development of nickel and silver ceramic filters supported on K10 montmorillonite clay for water disinfection,2020.0,,,,CERÂMICA,,,"MORAES, L. T. DE (MORAES, L. T. DE), Antonio Ernandes Macêdo Paiva (Paiva, E. M.), Samuel Filgueiras Rodrigues (RODRIGUES, S. F.), José Hilton Gomes Rangel (RANGEL, J. H. G.), Marcelo Moizinho Oliveira (OLIVEIRA, M. M.)",A1
5967561730464803,10052024,Artigo Publicado,Structure-directing study of 1-methylimidazolium-based dication with tetramethylene as spacer length in the synthesis of microporous silicoaluminophosphates,2021.0,,,,NEW JOURNAL OF CHEMISTRY,,,"TAVARES, THAYARA   KELLEN (TAVARES, THAYARA   KELLEN), ALMEIDA, GABRIELLI (ALMEIDA, GABRIELLI), VARIANI, YURI (VARIANI, YURI), BERNARDO-GUSMÃO, KATIA (BERNARDO-GUSMÃO, KATIA), VINACHES, PALOMA (VINACHES, PALOMA), ALCÂNTARA, ANA C. S. (ALCÂNTARA, ANA C. S.), Antonio Ernandes Macêdo Paiva (PAIVA, ANTÔNIO   ERNANDES MACEDO), GÓMEZ-HORTIGÜELA, LUIS (GÓMEZ-HORTIGÜELA, LUIS), ROJAS, ALEX (ROJAS, ALEX)",C
5967561730464803,10052024,Artigo Publicado,Utilization of Acai Berry Residual Biomass for Extraction of Lignocellulosic Byproducts,2021.0,,,,Journal of Bioresources and Bioproducts,,,"LINAN, LAMIA ZUNIGA (LINAN, LAMIA ZUNIGA), CIDREIRA, ANNE C. MENDONÇA (CIDREIRA, ANNE C. MENDONÇA), DA ROCHA, CLÁUDIA QUINTINO (DA ROCHA, CLÁUDIA QUINTINO), DE MENEZES, FABRÍCIA FARIAS (DE MENEZES, FABRÍCIA FARIAS), ROCHA, GEORGE J DE MORAES (ROCHA, GEORGE J DE MORAES), Antonio Ernandes Macêdo Paiva (PAIVA, ANTÔNIO E MACEDO)",B1
5967561730464803,10052024,Artigo Publicado,Thermal kinetics on adsorption heat transformation based on activated biocarbon and ethanol as working pairs,2022.0,,,,MATERIALS LETTERS,,,"CARVALHO-FILHO, ALUIZIO F. (CARVALHO-FILHO, ALUIZIO F.), ALCÂNTARA, ANA C.S. (ALCÂNTARA, ANA C.S.), Antonio Ernandes Macêdo Paiva (PAIVA, ANTÔNIO E.M.), PASSINHO-SILVA, JORGE J. (PASSINHO-SILVA, JORGE J.), PEREZ-CARVAJAL, JAVIER (PEREZ-CARVAJAL, JAVIER), ROJAS, ALEX (ROJAS, ALEX)",A1
5967561730464803,10052024,Artigo Publicado,Physical Simulation Based on Dynamic Transformation Under Hot Plate Rolling of a Nb-Microalloyed Steel,2021.0,,,,FRONTIERS IN MATERIALS,,,"FERREIRA, JOÃO CARLOS (FERREIRA, JOÃO CARLOS), DE SOUSA MACHADO, FRANCISCO ROMARIO (DE SOUSA MACHADO, FRANCISCO ROMARIO), ARANAS, CLODUALDO (ARANAS, CLODUALDO), SICILIANO, FULVIO (SICILIANO, FULVIO), PASCO, JUBERT (PASCO, JUBERT), REIS, GEDEON SILVA (REIS, GEDEON SILVA), PEDROSA DE MIRANDA, EDSON JANSEN (PEDROSA DE MIRANDA, EDSON JANSEN), Antonio Ernandes Macêdo Paiva (MACÊDO PAIVA, ANTÔNIO ERNANDES), RODRIGUES, SAMUEL FILGUEIRAS (RODRIGUES, SAMUEL FILGUEIRAS)",A3
5967561730464803,10052024,Artigo Publicado,Compressive strength of premolars restored with ceramic crowns and supported with a glass fiber post using different luting agents,2022.0,,,,THE SAUDI DENTAL JOURNAL,,,"PAIXÃO, FLÁVIA CARVALHO DE OLIVEIRA (PAIXÃO, FLÁVIA CARVALHO DE OLIVEIRA), PINHEIRO RODRIGUES, VANDILSON (PINHEIRO RODRIGUES, VANDILSON), GEORGE, ROY (GEORGE, ROY), Souza, Soraia de Fátima Carvalho (Souza, Soraia de Fátima Carvalho), Antonio Ernandes Macêdo Paiva (PAIVA, ANTONIO ERNANDES MACÊDO), PEREIRA, ADRIANA DE FÁTIMA VASCONCELOS (PEREIRA, ADRIANA DE FÁTIMA VASCONCELOS)",B4
5967561730464803,10052024,Artigo Publicado,Fabrication of new Ag2CrO4/Ag2MoO4 and Ag2CrO4/Ag2WO4 heterostructures with enhanced degradation of the mixture of dyes by photocatalysis,2022.0,,,,JOURNAL OF ALLOYS AND COMPOUNDS,,,"J.M.P. Silva (SILVA, J.), N.F. Andrade Neto (ANDRADE NETO, N.), M.D. Teodoro (TEODORO, M.), Antonio Ernandes Macêdo Paiva (Paiva, A. E. M.), M.R.D. Bomio (BOMIO, M.), F.V. Motta (MOTTA, F.)",B1
5967561730464803,10052024,Artigo Publicado,Influência do gás de purga na prevenção da trinca de hidrogênio em juntas soldadas de um aço API 5L X80,2021.0,,,,"TECNOLOGIA EM METALURGIA, MATERIAIS E MINERAÇÃO",,,"VIEIRA, ROBERTA ADRIELLE LIMA (VIEIRA, ROBERTA ADRIELLE LIMA), MARTINS, WALDEMIR DOS PASSOS (MARTINS, WALDEMIR DOS PASSOS), LEAL, VALDEMAR SILVA (LEAL, VALDEMAR SILVA), Antonio Ernandes Macêdo Paiva (PAIVA, ANTONIO ERNANDES MACÊDO)",A3
5967561730464803,10052024,Artigo Publicado,Avaliação do desempenho de rebolos para o esmerilhamento de trilhos,2023.0,,,,"TECNOLOGIA EM METALURGIA, MATERIAIS E MINERAÇÃO",,,"PRETTI, ERIC (PRETTI, ERIC), Antonio Ernandes Macêdo Paiva (PAIVA, ANTÔNIO ERNANDES MACÊDO)",A3
5967561730464803,10052024,Artigo Publicado,Dispersion Diagram of Trigonal Piezoelectric Phononic Structures with Langasite Inclusions,2021.0,,,,Crystals,,,"MIRANDA, EDSON (MIRANDA, EDSON), ARANAS, CLODUALDO (ARANAS, CLODUALDO), RODRIGUES, SAMUEL (RODRIGUES, SAMUEL), SILVA, HÉLIO (SILVA, HÉLIO), REIS, GEDEON (REIS, GEDEON), Antonio Ernandes Macêdo Paiva (PAIVA, ANTÔNIO), DOS SANTOS, JOSÉ (DOS SANTOS, JOSÉ)",A3
2920215807337108,7062024,Artigo Publicado,Betulinic Acid Prevents the Acquisition of Ciprofloxacin-Mediated Mutagenesis in Staphylococcus aureus,2019.0,,,,MOLECULES,,,"Alexsander Rodrigues Carvalho Junior (CARVALHO JUNIOR, A. R.), Giselle Maria Skelding Pinheiro Guilhon (GUILHON, G. M. S. P.), Antonio José Cantanhede Filho (CANTANHEDE FILHO, ANTONIO JOSÉ), Luis Claudio Nascimento da Silva (SILVA, L. C. N.), Arthur Lima de Berredo Martins (MARTINS, A. L. B.), Brenda da Silva Cutrim (CUTRIM, B. S.), Deivid Martins Santos (SANTOS, D. M.), Hermerson Sousa Maia (MAIA, H. S.), Mari Silma Maia da Silva (SILVA, M. S. M.), Adrielle Zagmignan (ZAGMIGNAN, A.), Maria Raimunda Chagas Silva (SILVA, M. R. C.), Cristina de Andrade Monteiro (MONTEIRO, C. A.)",B1
2920215807337108,7062024,Artigo Publicado,Luehea candicans Increase In Vitro Cell Cancer Metabolism Even with High Polyphenols Content,2019.0,,,,MEDICINAL & AROMATIC PLANTS,,,"Marcos Bispo Pinheiro Camara (CAMARA, M. B. P.), Ana Carolina Silveira Rabelo (RABELO, A. C. S.), Jessica Borghesi (BORGHESI, J.), Fernanda Bessa (BESSA, F.), Rodrigo da Silva Nunes Barreto (BARRETO, Rodrigo da Silva Nunes), MIGLINO, MARIA A. (MIGLINO, MARIA A.), Antonio José Cantanhede Filho (CANTANHEDE FILHO, A. J.), Fernando José Costa Carneiro (CARNEIRO, F. J. C.)",A2
2920215807337108,7062024,Artigo Publicado,MICRO-NANOFIBRAS DE POLI(ÁCIDO LÁCTICO) FABRICADAS POR ELECTROSPINNING Y ENCAPSULACIÓN DE 2-[(E)-4-(DIMETILAMINO)BENZILIDENO)]INDAN-1-ONA,2019.0,,,,REVISTA LATINOAMERICANA DE METALURGIA Y MATERIALES,,,"Jesús Eduardo Campos Pacheco (PACHECO, J. E. C.), Liana Hurtado (HURTADO, L.), Neudo Urdaneta (URDANETA, N.), Antonio José Cantanhede Filho (CANTANHEDE FILHO, A. J.), Railda Neiva Moreira Araujo (ARAUJO, R. N. M.), Marco Antonio Sabino Gutierrez (GUTIERREZ, M. A. S.)",A2
2920215807337108,7062024,Artigo Publicado,Analysis of Phenolic Compounds from Cowpea (Vigna unguiculata) by HPLC-DAD-MS/MS,2021.0,,,,Brazilian Journal of Food and Technology,,,"REINALDO ARAUJO DOS SANTOS (SANTOS, R. A.), Antonio José Cantanhede Filho (CANTANHEDE FILHO, ANTONIO JOSÉ), Antonio Pedro Silva Souza Filho (SOUZA FILHO, A. P. S.), Giselle Maria Skelding Pinheiro Guilhon (GUILHON, G. M. S. P.), Lourivaldo da Silva Santos (SANTOS, L. S.)",A2
2920215807337108,7062024,Artigo Publicado,Calotropis procera (Aiton) Dryand (Apocynaceae) as an anti-cancer agent against canine mammary tumor and osteosarcoma cells,2021.0,,,,RESEARCH IN VETERINARY SCIENCE,,,"RABELO, ANA CAROLINASILVEIRA (RABELO, ANA CAROLINASILVEIRA), MIGLINO, MARIA ANGÉLICA (MIGLINO, MARIA ANGÉLICA), BORGHESI, JÉSSICA (BORGHESI, JÉSSICA), CARREIRA, ANA CLAUDIA O. (CARREIRA, ANA CLAUDIA O.), HAYASHI, RAFAEL GONÇALVES (HAYASHI, RAFAEL GONÇALVES), BESSA, FERNANDA (BESSA, FERNANDA), Rodrigo da Silva Nunes Barreto (BARRETO, Rodrigo da Silva Nunes), DA COSTA, ROMÁRIO PEREIRA (DA COSTA, ROMÁRIO PEREIRA), Antonio José Cantanhede Filho (CANTANHEDE FILHO, ANTÔNIO JOSÉ), CARNEIRO, FERNANDO JOSÉ COSTA (CARNEIRO, FERNANDO JOSÉ COSTA)",B1
2920215807337108,7062024,Artigo Publicado,Antimicrobial activity of extracts from the Humiria balsamifera (Aubl),2021.0,,,,PLANTS,,,"Edelson de Jesus Sá Dias (DIAS, E. J. S.), Antonio José Cantanhede Filho (CANTANHEDE FILHO, A. J.), Fernando José Costa Carneiro (CARNEIRO, F. J. C.), CLÁUDIA QUINTINO ROCHA (ROCHA, C. Q.), Luis Claudio Nascimento da Silva (SILVA, L. C. N.), Joice Castelo Branco Santos (SANTOS, J. C. B.), Thayná Fernandes Barros (BARROS, T. F.), Deivid Martins Santos (SANTOS, D. M.)",B1
2920215807337108,7062024,Artigo Publicado,Lactones from Glomerella cingulata Cultivated in Rice:Structural Studies and Antimicrobial Evaluation,2022.0,,,,Records of Natural Products,,,"Nayara de Freitas Gomes (GOMES, N. F.), Manoel Leão Lopes Junior (LOPES JUNIOR, M. L.), Antonio José Cantanhede Filho (CANTANHEDE FILHO, ANTONIO JOSÉ), Lourivaldo da Silva Santos (SANTOS, L. S.), Luis Claudio Nascimento da Silva (SILVA, L. C. N.), EDSON RODRIGUES FILHO (RODRIGUES FILHO, E.)",A1
2920215807337108,7062024,Artigo Publicado,Short-term intake of Theobroma grandiflorum juice fermented with Lacticaseibacillus rhamnosus ATCC 9595 amended the outcome of endotoxemia induced by lipopolysaccharide,2023.0,,,,Nutrients,,,"Adrielle Zagmignan (ZAGMIGNAN, A.), Edinalva Rodrigues Alves (ALVES, E. R.), Bárbara Lima de Almeida (ALMEIDA, B. L.), Anne Karoline Maiorana Santos (SANTOS, A. K. M.), Wellyson da Cunha Araújo Firmo (FIRMO, W. C. A.), Maria Raimunda Chagas Silva (SILVA, M. R. C.), Antonio José Cantanhede Filho (FILHO, ANTONIO JOSE CANTANHEDE), Rita de Cássia Mendonça de Miranda (MIRANDA, R. C. M.), Luis Claudio Nascimento da Silva (SILVA, L. C. N.), Yasmim Costa Mendes (MENDES, Y. C.), Gabrielle Pereira Mesquita (MESQUITA, G. P.), Gabrielle Damasceno Costa dos Santos (SANTOS, G. D. C.), Lucas dos Santos Silva (SILVA, L. S.), Amanda Caroline de Souza Sales (SALES, A. C. S.), Simeone Júlio dos Santos Castelo Branco (BRANCO, S. J. S. C.), Alexsander Rodrigues Carvalho Junior (CARVALHO JUNIOR, A. R.), José Manuel Noguera Bazán (BAZAN, J. M. N.)",B1
2920215807337108,7062024,Artigo Publicado,Calotropis Procera Induced Caspase-Dependent Apoptosis and Impaired Akt/mTORSignaling in 4T1 Breast Cancer Cells,2022.0,,,,Anti-Cancer Agents in Medicinal Chemistry,,,"RABELO, ANA CAROLINA SILVEIRA (RABELO, ANA CAROLINA SILVEIRA), MIGLINO, MARIA ANGÉLICA (MIGLINO, MARIA ANGÉLICA), ARBIZU, SHIRLEY (ARBIZU, SHIRLEY), CARREIRA, ANA CLÁUDIA O. (CARREIRA, ANA CLÁUDIA O.), Antonio José Cantanhede Filho (FILHO, ANTÔNIO JOSÉ CANTANHEDE), CARNEIRO, FERNANDO JOSÉ COSTA (CARNEIRO, FERNANDO JOSÉ COSTA), LAYOSA, MARJORIE ANNE A. (LAYOSA, MARJORIE ANNE A.), NORATTO, GIULIANA (NORATTO, GIULIANA)",A1
2920215807337108,7062024,Artigo Publicado,Calotropis procera (Aiton) Dryand (Apocynaceae): state of the art of its use and applications,2023.0,,,,CURRENT TOPICS IN MEDICINAL CHEMISTRY,,,"RABELO, ANA CAROLINA SILVEIRA (RABELO, ANA CAROLINA SILVEIRA), NORATTO, GIULIANA D. (NORATTO, GIULIANA D.), BORGHESI, JESSICA (BORGHESI, JESSICA), SOUZA FONSECA, ADRIANO (SOUZA FONSECA, ADRIANO), Antonio José Cantanhede Filho (CANTANHEDE FILHO, ANTÔNIO JOSÉ), COSTA CARNEIRO, FERNANDO JOSÉ (COSTA CARNEIRO, FERNANDO JOSÉ), ABREU-SILVA, ANA LÚCIA (ABREU-SILVA, ANA LÚCIA), MIGLINO, MARIA ANGÉLICA (MIGLINO, MARIA ANGÉLICA)",A3
2920215807337108,7062024,Artigo Publicado,Unraveling the abnormal NMR spectra of oxaline and its spiroaminal congeners fungal alkaloids: the spatial effect of quadrupolar nitrogen nuclei,2023.0,,,,JOURNAL OF MOLECULAR STRUCTURE,,,"SANTOS, ANNE KAROLINE MAIORANA (SANTOS, ANNE KAROLINE MAIORANA), KUZBETSOV, ALEKSEY E. (KUZBETSOV, ALEKSEY E.), VENÂNCIO, TIAGO (VENÂNCIO, TIAGO), Antonio José Cantanhede Filho (FILHO, ANTÔNIO JOSÉ CANTANHÊDE), RODRIGUES-FILHO, EDSON (RODRIGUES-FILHO, EDSON)",B1
7768340690883764,5042024,Artigo Publicado,AS POLÍTICAS DE DESENVOLVIMENTO DA PESCA NO BRASIL (DÉCADAS DE 1960 - 1980) E SEUS EFEITOS SOBRE OS MODOS DE VIDA DAS COMUNIDADES DE PESCADORES ARTESANAIS / FISHERIES DEVELOPMENT POLICIES IN BRAZIL (1960S - 1980S) AND THEIR EFFECTS ON THE LIVELIHOODS OF ARTISANAL FISHING COMMUNITIES,2020.0,,,,Brazilian Journal of Development,,,"TSUJI, TITO CARVALHO (TSUJI, TITO CARVALHO), Camila Andrade dos Santos (SANTOS, CAMILA ANDRADE DOS)",B4
7768340690883764,5042024,Artigo Publicado,"UMA EXPERIÊNCIA DE EXTENSÃO EM DESIGN NA RESERVA EXTRATIVISTA QUILOMBO FRECHAL, MARANHÃO/BRASIL/ AN EXTENSION EXPERIENCE IN DESIGN AT QUILOMBO FRECHAL EXTRACTIVE RESERVE, MARANHÃO/BRAZIL",2020.0,,,,Brazilian Journal of Development,,,"Camila Andrade dos Santos (SANTOS, Camila Andrade dos)",B4
7768340690883764,5042024,Artigo Publicado,Ensino do Design na relação Trabalho e Educação: breve análise dos desafios históricos na Rede Federal de Educação Profissional e Tecnológica no Brasil,2022.0,,,,"Arcos (Rio de Janeiro) : design, cultura, material e visualidade",,,"DA HORA, LICIA CRISTINA ARAÚJO (DA HORA, LICIA CRISTINA ARAÚJO), Camila Andrade dos Santos (ANDRADE DOS SANTOS, CAMILA), RODRIGUES, KAROLINE PARRIÃO (RODRIGUES, KAROLINE PARRIÃO), TSUJI, TITO CARVALHO (TSUJI, TITO CARVALHO)",B1
7768340690883764,5042024,Artigo Publicado,O lúdico no quilombo: um ensaio fotoetnográfico sobre a situação do brincar no Quilombo Urbano da Liberdade,2023.0,,,,AntHropológicas Visual,,,"Camila Andrade dos Santos (SANTOS, CAMILA ANDRADE DOS)",B4
6376710096145623,12052024,Artigo Publicado,"Dizygostemon riparius (Plantaginaceae, Gratioleae), a new species from Maranhão, northeastern Brazil",2019.0,,,,Willdenowia,,,"André Vito Scatigna (SCATIGNA, A. V.), Clenilma Marques Brandão (BRANDAO, C. M.), Gabriel Dalla Colletta (COLLETTA, G. D.), Rogério de Mesquita Teles (TELES, R. M.), Kiany Sirley Brandão Cavalcante (CAVALCANTE, K. S. B.), Vinicius Castro Souza (SOUZA, V. C.), André Olmos Simões (SIMOES, A. O.)",B1
6376710096145623,12052024,Artigo Publicado,BIOPROSPECTION OF MANGABA (HANCORNIA SPECIOSA Gomes) NATIVE IN THE TRANSITION REGION SAVANNA-RESTINGA,2020.0,,,,INTERNATIONAL JOURNAL OF DEVELOPMENT RESEARCH,,,"Georgiana Eurides de Carvalho Marques (MARQUES, G. E. C.), Clenilma Marques Brandão (BRANDAO, C. M.), Djanira Rubim dos Santos (SANTOS, D. R.), Juliane Cutrim Marques (MARQUES, J. C.)",A1
6376710096145623,12052024,Artigo Publicado,"Composition and Larvicidal Activity of the Oil of Dizygostemon riparius</i> (Plantaginaceae), a New Aromatic Species Occurring in Maranhão, Brazil",2020.0,,,,CHEMISTRY & BIODIVERSITY,,,"Clenilma Marques Brandão (BRANDÃO, CLENILMA M.), CAVALCANTE, KIANY SIRLEY B. (CAVALCANTE, KIANY SIRLEY B.), M. TELES, ROGÉRIO (M. TELES, ROGÉRIO), C. MARQUES, GEORGIANA E. (C. MARQUES, GEORGIANA E.), MONTEIRO, ODAIR S. (MONTEIRO, ODAIR S.), ANDRADE, ELOISA HELENA A. (ANDRADE, ELOISA HELENA A.), MAIA, JOSÉ GUILHERME S. (MAIA, JOSÉ GUILHERME S.)",B2
6376710096145623,12052024,Artigo Publicado,"Ditos do Jatobá:desmatamento e falta de conservação de uma espécie nativa na visão de moradores da comunidade quilombola Damásio em Guimarães, Maranhão, Brasil",2020.0,,,,Cadernos de Agroecologia,,,"Ricardo Santos Avelar (AVELAR, R. S.), Georgiana Eurides de Carvalho Marques (MARQUES, G. E. C.), Clenilma Marques Brandão (BRANDÃO, CLENILMA M.)",A1
6376710096145623,12052024,Artigo Publicado,Sabor e saber tradicional em cookies a base da farinha de Jatobá (Hymenaea courbarilL.),2020.0,,,,Cadernos de Agroecologia,,,"Gabryela Diniz Dias (DIAS, G. D.), Georgiana Eurides de Carvalho Marques (MARQUES, G. E. C.), Clenilma Marques Brandão (BRANDÃO, CLENILMA M.)",A1
6376710096145623,12052024,Artigo Publicado,"Hancornia speciosa Gomes: caracterização química, compostos bioativos e atividade antioxidante",2022.0,,,,Brazilian Journal of Development,,,"Maria Eduarda Coutinho da Silva (SILVA, M. E. C.), Djanira Rubim dos Santos (SANTOS, D. R.), Eshylley Braenne Santos Santos (SANTOS, E. B. S.), Georgiana Eurides de Carvalho Marques (MARQUES, G. E. C.), Clenilma Marques Brandão (BRANDAO, C. M.), Daniely Veronica Viana Cardoso (CARDOSO, D. V. V.), Bruno de Araujo Gomes (GOMES, B. A.), Helen Karine Araujo Pereira (PEREIRA, H. K. A.), Flavia de Aquino Cutrim Farias (FARIAS, F. A. C.), Osmar Luis Silva Vasconcelos (VASCONCELOS, O. L. S.)",B4
6376710096145623,12052024,Artigo Publicado,"PARÂMETROS QUÍMICOS E BIOLÓGICOS DA ESPÉCIE NATIVA DUGUETIA FURFURACEA (A.ST.-HILL) ENCONTRADA NA ZONA TRANSIÇÃO DA AMAZÔNIA MARANHENSE, BRASIL",2022.0,,,,INTERNATIONAL JOURNAL OF DEVELOPMENT RESEARCH,,,"Jhovanna Teixeira Reis (REIS, J. T.), Micaelle Frota Gama (GAMA, M. F.), Naiara José Launé Ferreira (FERREIRA, N. J. L.), Georgiana Eurides de Carvalho Marques (MARQUES, G. E. C.), Flavia de Aquino Cutrim Farias (FARIAS, F. A. C.), Clenilma Marques Brandão (BRANDAO, C. M.), Roberta Almeida Muniz (MUNIZ, R. A.), Osmar Luiz Vasconcelos (VASCONCELOS, O. L.), Djanira Rubim dos Santos9 (SANTOS9, D. R.)",A1
6376710096145623,12052024,Artigo Publicado,Chemical profiling of Dizygostemon riparius (Plantaginaceae) plant extracts and its application against larvae of Aedes aegypti L. (diptera: culicidae),2023.0,,,,ACTA TROPICA,,,"Suzi Morais Aires Martins (MARTINS, S. M. A.), Kiany Sirley Brandão Cavalcante (CAVALCANTE, K. S. B.), Rogério de Mesquita Teles (TELES, R. M.), Clenilma Marques Brandão (BRANDAO, C. M.), Allan Sampaio Godinho (GODINHO, A. S.), Lanna Karinny Silva (SILVA, L. K.), Carlos Alexandre Holanda (HOLANDA, C. A.), Claudia Quintino da Rocha (ROCHA, C. Q.)",B2
6376710096145623,12052024,Artigo Publicado,Forest conservation and food production: cookies based on jatoba flour,2023.0,,,,OBSERVATORIO DE LA ECONOMÍA LATINOAMERICANA,,,"SILVA, LAYNNA STHEPHANY CORDEIRO (SILVA, LAYNNA STHEPHANY CORDEIRO), NEPOMUCENO, GABRIEL MARTINS (NEPOMUCENO, GABRIEL MARTINS), Clenilma Marques Brandão (Brandão, Clenilma Marques), DOS SANTOS, DJANIRA RUBIM (DOS SANTOS, DJANIRA RUBIM), Muniz, Roberta Almeida (Muniz, Roberta Almeida), VASCONCELOS, OSMAR LUIS SILVA (VASCONCELOS, OSMAR LUIS SILVA), DE CARVALHO, EDSON MAURO VIANA (DE CARVALHO, EDSON MAURO VIANA), Marques, Georgiana Eurides de Carvalho (Marques, Georgiana Eurides de Carvalho)",B1
