numero_identificador,data_atualizacao,tipo,titulo,ano,pais,evento,cidade,periodico,editora,descricao,autores,Qualis
3789595345955753,16052024,Artigo Publicado,Bacterial community associated with rhizosphere of maize and cowpea in a subsequent cultivation,2019.0,,,,APPLIED SOIL ECOLOGY,,,"DE ARAUJO, ADEMIR SERGIO FERREIRA (DE ARAUJO, ADEMIR SERGIO FERREIRA), Ana Roberta Lima de Miranda (MIRANDA, ANA ROBERTA LIMA), SOUSA, RICARDO SILVA (SOUSA, RICARDO SILVA), MENDES, LUCAS WILLIAM (MENDES, LUCAS WILLIAM), ANTUNES, JADSON EMANUEL LOPES (ANTUNES, JADSON EMANUEL LOPES), OLIVEIRA, LOUISE MELO DE SOUZA (OLIVEIRA, LOUISE MELO DE SOUZA), DE ARAUJO, FABIO FERNANDO (DE ARAUJO, FABIO FERNANDO), MELO, VANIA MARIA MACIEL (MELO, VANIA MARIA MACIEL), FIGUEIREDO, MARCIA DO VALE BARRETO (FIGUEIREDO, MARCIA DO VALE BARRETO)",B2
3789595345955753,16052024,Artigo Publicado,Dynamics of archaeal community in soil with application of composted tannery sludge,2019.0,,,,Scientific Reports,,,"Ana Roberta Lima de Miranda (MIRANDA, A. R. L.), lucas william mendes (MENDES, L. W.), Leandro Nascimento Lemos (LEMOS, L. N.), Jadson Emanuel Lopes Antunes (ANTUNES, J. E. L.), marineide rodrigues do Amorim (AMORIM, M. R.), MELO, VANIA MARIA MACIEL (MELO, VANIA MARIA MACIEL), Wanderley Jose de Melo (MELO, W. J.), Paul J van den Brink (van Den BRINK, P. J.), Ademir Sérgio Ferreira de Araújo (ARAÚJO, A. S. F.)",A1
3789595345955753,16052024,Artigo Publicado,Microbial co-occurrence network and its key microorganisms in soil with permanent application of composted tannery sludge,2021.0,,,,SCIENCE OF THE TOTAL ENVIRONMENT,,,"ISHIMOTO, CAROLINE KIE (ISHIMOTO, CAROLINE KIE), KUROSHU, REGINALDO MASSANOBU (KUROSHU, REGINALDO MASSANOBU), ESPOSITO, ELISA (ESPOSITO, ELISA), ARAUJO, ADEMIR SERGIO FERREIRA (ARAUJO, ADEMIR SERGIO FERREIRA), AONO, ALEXANDRE HILD (AONO, ALEXANDRE HILD), NAGAI, JAMES SHINITI (NAGAI, JAMES SHINITI), SOUSA, HÉRIO (SOUSA, HÉRIO), Ana Roberta Lima de Miranda (MIRANDA, ANA ROBERTA LIMA), MELO, VANIA MARIA MACIEL (MELO, VANIA MARIA MACIEL), MENDES, LUCAS WILLIAM (MENDES, LUCAS WILLIAM), ARAUJO, FABIO FERNANDO (ARAUJO, FABIO FERNANDO), DE MELO, WANDERLEY JOSÉ (DE MELO, WANDERLEY JOSÉ)",A3
3789595345955753,16052024,Artigo Publicado,Microbial communities in the rhizosphere of maize and cowpea respond differently to chromium contamination,2023.0,,,,CHEMOSPHERE,,,"Ademir Sérgio Ferreira de Araújo (ARAÚJO, A. S. F.), lucas william mendes (MENDES, L. W.), Ana Roberta Lima de Miranda (MIRANDA, A. R. L.), Arthur Prudêncio de Araújo Pereira (PEREIRA, A. P A.), MELO, WANDERLEY JOSÉ (MELO, WANDERLEY JOSÉ), MELO, VANIA MARIA MACIEL (MELO, VANIA MARIA MACIEL), SABRINA HERMELINDO VENTURA (VENTURA, S. H.), EUDEMIO SOUSA BRITO JUNIOR (BRITO JUNIOR, E. S.), ERIKA VALENTE DE MEDEIROS (MEDEIROS, E. V de), Fábio Fernando de Araújo (ARAUJO, F. F.)",A3
3789595345955753,16052024,Artigo Publicado,"Microbiological attributes, organic carbon, and soil hydrothermal regime under Copernicia prunifera waste application",2023.0,,,,International Journal Of Recycling Of Organic Waste In Agriculture,,,"Luiiz Alfredo Pinheiro Leal Nunes (NUNES, L. A. P. L.), Ana Roberta Lima de Miranda (MIRANDA, A. R. L.), Ricardo Silva de Sousa (SOUSA, R. S.)",B1
4754106250302979,4042024,Artigo Publicado,Ensino de Programação: uma revisão sistemática e as aplicações ao ensino profissionai,2020.0,,,,FUCAMP Cadernos,,,"Daniel Lima Gomes Júnior (GOMES JR, D. L.), Diego Ted Rodrigues Bogea (BOGEA, D. T. R.)",B3
4754106250302979,4042024,Artigo Publicado,Uso de português estruturado no ensino de alunos de computação com geração automatizada de códigos em linguagem Python,2022.0,,,,https://doi.org/10.34117/bjdv8n5-354,,,"ULYSSES SANTOS SOUSA (SOUSA, U. S.), Daniel Lima Gomes Júnior (GOMES JR, DANIEL LIMA), Kerlyson dos Santos Silva (SILVA, K. S.), Elias Rocha Lima (LIMA, E. R.)",B2
5620474615074689,6022024,Artigo Publicado,Phytostimulants influence the vase life of Heliconia psittacorum CV. golden torch,2019.0,,,,POSTHARVEST BIOLOGY AND TECHNOLOGY,,,"Diogo Herison Silva Sardinha (Sardinha, Diogo Herison Silva), Rodrigues, Antonia Alice Costa (Rodrigues, Antonia Alice Costa), RIBEIRO, SUZANE SÁ MATOS (RIBEIRO, SUZANE SÁ MATOS), DINIZ, NATHALIA BANDEIRA (DINIZ, NATHALIA BANDEIRA), CAMPOS NETO, JOSE RIBAMAR MUNIZ (CAMPOS NETO, JOSE RIBAMAR MUNIZ), REIS, FABRÍCIO DE OLIVEIRA (REIS, FABRÍCIO DE OLIVEIRA)",A4
3629845543120019,29082023,Artigo Publicado,Microbiolização de sementes de arroz com Bacillus spp. na redução de patógenos,2020.0,,,,"RESEARCH, SOCIETY AND DEVELOPMENT",,,"NASCIMENTO, IVANEIDE DE OLIVEIRA (NASCIMENTO, IVANEIDE DE OLIVEIRA), RODRIGUES, ANTÔNIA ALICE COSTA (RODRIGUES, ANTÔNIA ALICE COSTA), ANDRADE, KELE SOUSA PIRES (ANDRADE, KELE SOUSA PIRES), CUNHA, WANDERSON LIMA (CUNHA, WANDERSON LIMA), MORAES, FLÁVIO  HENRIQUE  REIS (MORAES, FLÁVIO  HENRIQUE  REIS), Flávia Arruda de Sousa (SOUSA, Flávia Arruda de)",B4
3630171389708262,25042024,Artigo Publicado,Dynamic Phase Transformation Behavior of a Nb-microalloyed Steel during Roughing Passes at Temperatures above the Ae3,2019.0,,,,Metals,,,"Samuel Filgueiras Rodrigues (RODRIGUES, S. F.), SICILIANO, FULVIO (SICILIANO, FULVIO), Clodualdo Aranas Jr (Arana Júnior, C.), Eden Santos Silva (Silva, E. S.), Gedeon Silva Reis (REIS, G. S.), Mohammad Jahazi (Jahazi, M.), JONAS, JOHN JOSEPH (JONAS, JOHN JOSEPH)",A2
3630171389708262,25042024,Artigo Publicado,Strain-Induced Ferrite Formation During Steckel Mill Simulations with Varying Roughing Pass Schedules,2019.0,,,,Metals,,,"Henry Barros Palhano (PALHANO, H.B.), Clodualdo Aranas Jr (Arana Júnior, C.), Samuel Filgueiras Rodrigues (RODRIGUES, S. F.), Eden Santos Silva (Silva, E. S.), SICILIANO, FULVIO (SICILIANO, FULVIO), Edson Jansen Pedrosa de Miranda Junior (MIRANDA JUNIOR, E. J. P.), Gedeon Silva Reis (REIS, G. S.), JONAS, JOHN JOSEPH (JONAS, JOHN JOSEPH)",A2
3630171389708262,25042024,Artigo Publicado,Delay in the static softening kinetics of a Nb-N-bearing austenitic stainless steel,2019.0,,,,Materials Research Express,,,"LEITÃO FILHO, SEBASTIÃO R J B (LEITÃO FILHO, SEBASTIÃO R J B), SILVA, EDEN SANTOS (SILVA, EDEN SANTOS), RODRIGUES, SAMUEL F. (RODRIGUES, SAMUEL F.), ARANAS JR., CLODUALDO (ARANAS JR., CLODUALDO), MIRANDA JR., EDSON JANSEN P (MIRANDA JR., EDSON JANSEN P), Gedeon Silva Reis (REIS, GEDEON SILVA), Balancin, Oscar (Balancin, Oscar)",A1
3630171389708262,25042024,Artigo Publicado,Induced ferrite formation above the Ae3 during plate rolling simulation of a X70 steel,2019.0,,,,MRS Advances,,,"RODRIGUES, SAMUEL F. (RODRIGUES, SAMUEL F.), CARNEIRO, THIAGO B. (CARNEIRO, THIAGO B.), ARANAS, CLODUALDO (ARANAS, CLODUALDO), SILVA, EDEN S. (SILVA, EDEN S.), SICILIANO, FULVIO (SICILIANO, FULVIO), Gedeon Silva Reis (REIS, GEDEON S.), JONAS, JOHN J. (JONAS, JOHN J.)",B1
3630171389708262,25042024,Artigo Publicado,Thermomechanical Behavior of Biocompatible Austenitic Stainless Steels during Simulated Torsion Tests,2019.0,,,,JOURNAL OF MATERIALS ENGINEERING AND PERFORMANCE,,,"Felipe Anderson Silva de Aquino (DE Aquino, F. A.S.), Samuel Filgueiras Rodrigues (RODRIGUES, Samuel. F.), Eden Santos Silva (Silva, E. S.), SICILIANO, FULVIO (SICILIANO, FULVIO), Gedeon Silva Reis (REIS, G. S.)",A2
3630171389708262,25042024,Artigo Publicado,Estudo da eficiência do Orbignya oleifera como inibidor verde de corrosão para aço com baixo teor de carbono comparado com inibidor comercial em solução HCl 1M,2019.0,,,,Materia-Rio de Janeiro,,,"PERES, JHONATAN (PERES, JHONATAN), CONDE, RENATO (CONDE, RENATO), BEZERRA, CAMILLA (BEZERRA, CAMILLA), COSTA, RITA (COSTA, RITA), Gedeon Silva Reis (REIS, GEDEON), SOUZA, MARIA ELIZIANE PIRES DE (SOUZA, MARIA ELIZIANE PIRES DE), NASCIMENTO, CARMEM (NASCIMENTO, CARMEM)",A2
3630171389708262,25042024,Artigo Publicado,Thermomechanical Behavior and Corrosion Resistance of a 316 L Austenitic Stainless Steel,2020.0,,,,MATERIALS SCIENCES AND APPLICATIONS (PRINT),,,"FERREIRA, RAFAEL P. (FERREIRA, RAFAEL P.), NASCIMENTO, CARMEM C. F. (NASCIMENTO, CARMEM C. F.), Gedeon Silva Reis (REIS, GEDEON S.), SILVA, EDEN S. (SILVA, EDEN S.), RODRIGUES, SAMUEL F. (RODRIGUES, SAMUEL F.)",A3
3630171389708262,25042024,Artigo Publicado,Softening-precipitation interaction in a Nb-and N-bearing austenitic stainless steel under stress relaxation,2020.0,,,,Journal of Materials Research and Technology-JMR&T,,,"Elivaldo Ribeiro Sá (Sá, E.R.), Samuel Filgueiras Rodrigues (RODRIGUES, Samuel. F.), Clodualdo Aranas Jr (Arana Júnior, C.), SICILIANO, FULVIO (SICILIANO, FULVIO), Gedeon Silva Reis (REIS, G. S.), José Maria Cabrera (CABRERA, J. M.), Eden Santos Silva (Silva, E. S.)",A3
3630171389708262,25042024,Artigo Publicado,Constitutive Analysis of the Mean Flow Stress of a Nb- and N-Bearing Austenitic Stainless Steel Biomaterial,2020.0,,,,METALS AND MATERIALS INTERNATIONAL,,,"DOS SANTOS FILHO, NELSON LUIS COSTA (DOS SANTOS FILHO, NELSON LUIS COSTA), SILVA, EDEN SANTOS (SILVA, EDEN SANTOS), ARANAS, CLODUALDO (ARANAS, CLODUALDO), SICILIANO, FULVIO (SICILIANO, FULVIO), Gedeon Silva Reis (REIS, GEDEON SILVA), RODRIGUES, SAMUEL FILGUEIRAS (RODRIGUES, SAMUEL FILGUEIRAS)",A4
3630171389708262,25042024,Artigo Publicado,Modelling Propagating Bloch Waves in Magnetoelectroelastic Phononic Structures with Kagomé Lattice Using the Improved Plane Wave Expansion,2020.0,,,,Crystals,,,"Edson Jansen Pedrosa de Miranda Junior (MIRANDA JUNIOR, E. J. P.), Samuel Filgueiras Rodrigues (RODRIGUES, Samuel. F.), Clodualdo Aranas Jr (Arana Júnior, C.), Hélio Vitor Cantanhêde da Silva (Da Silva, H.V.C.), Eden Santos Silva (Silva, E. S.), Gedeon Silva Reis (REIS, G. S.), Antonio Ernandes Macedo Paiva (PAIVA, A. E. M.), José Maria Campos Dos Santos (Dos Santos, J.M.C.)",A3
3630171389708262,25042024,Artigo Publicado,Retransformation of dynamically induced ferrite during physical simulation of Steckel mill hot rolling,2020.0,,,,Journal of Materials Research and Technology-JMR&T,,,"Thiago Bruno Carneiro (Carneiro, T.B.), John Joseph Jonas (JONAS, J. J.), Samuel Filgueiras Rodrigues (RODRIGUES, Samuel. F.), Clodualdo Aranas Jr (Arana Júnior, C.), Fulvio Siciliano (SICILIANO, F.), Eden Santos Silva (Silva, E. S.), Gedeon Silva Reis (REIS, GEDEON S.), Edson Jansen Pedrosa de Miranda Junior (MIRANDA JUNIOR, E. J. P.), Valdemar Silva Leal (LEAL, V. S.), Mohammad Jahazi (Jahazi, M.)",A3
3630171389708262,25042024,Artigo Publicado,Dispersion Diagram of Trigonal Piezoelectric Phononic Structures with Langasite Inclusions,2021.0,,,,Crystals,,,"MIRANDA, EDSON (MIRANDA, EDSON), ARANAS, CLODUALDO (ARANAS, CLODUALDO), RODRIGUES, SAMUEL (RODRIGUES, SAMUEL), SILVA, HÉLIO (SILVA, HÉLIO), Gedeon Silva Reis (REIS, GEDEON), PAIVA, ANTÔNIO (PAIVA, ANTÔNIO), DOS SANTOS, JOSÉ (DOS SANTOS, JOSÉ)",A3
3630171389708262,25042024,Artigo Publicado,Monitoramento da corrosão do aço de baixo carbono em sistema com fluxo turbulento de NaCl 3%: uma investigação eletroquímica,2021.0,,,,Materia-Rio de Janeiro,,,"PERES, JHONATAN (PERES, JHONATAN), José Marcos Soares do Nascimento (Nascimento, J.M.S.), Carmem Célia Francisco do  Nascimento (NASCIMENTO, C. C. F.), Gedeon Silva Reis (REIS, G. S.), Ferdinando Marco Rodrigues Borges (Borges, F. M. R.), Maria Eliziane Pires  de Souza (de Souza  M. E. P.), José Carlos Silva Rocha Junior (Rocha Júnior, J.C.S.)",A2
3630171389708262,25042024,Artigo Publicado,Physical Simulation Based on Dynamic Transformation Under Hot Plate Rolling of a Nb-Microalloyed Steel,2021.0,,,,FRONTIERS IN MATERIALS,,,"FERREIRA, JOÃO CARLOS (FERREIRA, JOÃO CARLOS), DE SOUSA MACHADO, FRANCISCO ROMARIO (DE SOUSA MACHADO, FRANCISCO ROMARIO), ARANAS, CLODUALDO (ARANAS, CLODUALDO), SICILIANO, FULVIO (SICILIANO, FULVIO), PASCO, JUBERT (PASCO, JUBERT), Gedeon Silva Reis (REIS, GEDEON SILVA), PEDROSA DE MIRANDA, EDSON JANSEN (PEDROSA DE MIRANDA, EDSON JANSEN), MACÊDO PAIVA, ANTÔNIO ERNANDES (MACÊDO PAIVA, ANTÔNIO ERNANDES), RODRIGUES, SAMUEL FILGUEIRAS (RODRIGUES, SAMUEL FILGUEIRAS)",A3
3630171389708262,25042024,Artigo Publicado,Solubility product of a Nb&#45;N bearing austenitic stainless-steel biomaterial,2021.0,,,,Journal of Materials Research and Technology-JMR&T,,,"SILVA, KAYRON LIMA (SILVA, KAYRON LIMA), RODRIGUES, SAMUEL FILGUEIRAS (RODRIGUES, SAMUEL FILGUEIRAS), MACEDO, GLAUCIA MARIA EVANGELISTA (MACEDO, GLAUCIA MARIA EVANGELISTA), SOUSA LOPES, BRUNO LEONARDY (SOUSA LOPES, BRUNO LEONARDY), ARANAS, CLODUALDO (ARANAS, CLODUALDO), SICILIANO, FULVIO (SICILIANO, FULVIO), Gedeon Silva Reis (REIS, GEDEON SILVA), SILVA, EDEN SANTOS (SILVA, EDEN SANTOS)",A3
3630171389708262,25042024,Artigo Publicado,Dynamic Ferrite Formation and Evolution above the Ae3 Temperature during Plate Rolling Simulation of an API X80 Steel,2022.0,,,,Metals,,,"DE SOUSA MACHADO, FRANCISCO ROMARIO (DE SOUSA MACHADO, FRANCISCO ROMARIO), Samuel Filgueiras Rodrigues (RODRIGUES, S. F.), Maria Veronica G. Rodrigues (RODRIGUES, M. V. G.), Marcos Natan da S. Lima (LIMA, M. N. S.), Rodrigo de C. Paes Loureiro (LOUREIRO, R. C. P.), Fulvio Siciliano (SICILIANO, F.), Gedeon Silva Reis (REIS, G. S.), Regina Célia de Sousa (SOUSA, Regina Célia), Clodualdo Aranas Jr (Arana Júnior, C.), Hamilton Ferreira Gomes de Abreu (de Abreu, H. F. G.)",A2
3630171389708262,25042024,Artigo Publicado,Constitutive analysis of stress-strain curves in dynamic softening of high Nb- and N-containing austenitic stainless-steel biomaterial,2022.0,,,,Journal of Materials Research and Technology-JMR&T,,,"Gláucia Adriane de Sousa Sulzbach (SULZBACH, G. A. S.), Maria Veronica G. Rodrigues (RODRIGUES, M. V. G.), Samuel Filgueiras Rodrigues (RODRIGUES, S. F.), Glaucia Maria Evangelista Macedo (MACEDO, G. M. E.), Hamilton Ferreira Gomes de Abreu (de Abreu, H. F. G.), Clodualdo Aranas Jr (Arana Júnior, C.), Gedeon Silva Reis (Reis, G.S.), Eden Santos Silva (Silva, E. S.)",A3
3630171389708262,25042024,Artigo Publicado,Microstructural and Texture Evolution of Pearlite-Drawn Wires for Flexible Marine Pipelines: Investigating the Effect of Heat Treatments on Mechanical Properties,2023.0,,,,Metals,,,"PINHEIRO, PEDRO H. (PINHEIRO, PEDRO H.), MASOUMI, MOHAMMAD (MASOUMI, MOHAMMAD), HERCULANO, LUÍS FLÁVIO G. (HERCULANO, LUÍS FLÁVIO G.), XAVIER, JOÃO VICTOR B. (XAVIER, JOÃO VICTOR B.), DE LIMA, SAMILLE KRICIA B. (DE LIMA, SAMILLE KRICIA B.), SILVA, EDEN S. (SILVA, EDEN S.), Gedeon Silva Reis (REIS, GEDEON S.), RODRIGUES, SAMUEL F. (RODRIGUES, SAMUEL F.), DE ABREU, HAMILTON F. GOMES (DE ABREU, HAMILTON F. GOMES)",A2
3630171389708262,25042024,Artigo Publicado,Assessing the Influence of Cyclic Bending on Pearlitic Wire's Microstructural Evolution: A Simulation of Spiraling and Armoring Processing Effects,2023.0,,,,Journal of Materials Research and Technology-JMR&T,,,"PINHEIRO LIMA, PEDRO HENRIQUE (PINHEIRO LIMA, PEDRO HENRIQUE), SILVA, EDEN SANTOS (SILVA, EDEN SANTOS), RODRIGUES, SAMUEL FILGUEIRAS (RODRIGUES, SAMUEL FILGUEIRAS), GOMES DE ABREU, HAMILTON FERREIRA (GOMES DE ABREU, HAMILTON FERREIRA), BEZERRA DE LIMA, SAMILLE KRYCIA (BEZERRA DE LIMA, SAMILLE KRYCIA), GONCALVES RODRIGUES, MARIA VERONICA (GONCALVES RODRIGUES, MARIA VERONICA), GASPAR HERCULANO, LUIS FLAVIO (GASPAR HERCULANO, LUIS FLAVIO), DE PAES LOUREIRO, RODRIGO CARVALHO (DE PAES LOUREIRO, RODRIGO CARVALHO), FREIRE, SUYANNY ASSUNÇÃO (FREIRE, SUYANNY ASSUNÇÃO), CARDOSO, JORGE LUIZ (CARDOSO, JORGE LUIZ), MASOUMI, MOHAMMAD (MASOUMI, MOHAMMAD), Gedeon Silva Reis (REIS, GEDEON SILVA)",A3
3630171389708262,25042024,Artigo Publicado,Influence of the morphology of eutectoid steels on corrosion resistance in NaCl aqueous medium with and without CO2,2023.0,,,,Metals,,,"Francisco Felipe de M. Fideles (FIDELES, F. F. M.), Gedeon Silva Reis (REIS, G. S.), Eden Santos Silva (Eden Santos Silva), Hamilton F. Gomes De Abreu (ABREU, H. F. G.), Mauro Andrés C. Florez (FLOREZ, M. A. C.), Maria Veronica G. Rodrigues (RODRIGUES, M. V. G.), Jorge Luiz Cardoso (Jorge Luiz Cardoso), Clodualdo Aranas Jr (Arana Júnior, C.), Samuel F. Rodrigues (RODRIGUES, S. F.), Marcos Natan da S. Lima (LIMA, M. N. S.), Caio Victor P. Pascoal (PASCOAL, C. V. P.), Thiago Alves De Moura (Thiago Alves De Moura)",A2
3630171389708262,25042024,Artigo Publicado,HIGH-TEMPERATURE DEFORMATION BEHAVIOR OF HIGH-NB MICROALLOYED STEEL DURING PLATE ROLLING SIMULATION,2020.0,,,,"TECNOLOGIA EM METALURGIA, MATERIAIS E MINERAÇÃO (IMPRESSO)",,,"RODRIGUES, SAMUEL FILGUEIRAS (RODRIGUES, SAMUEL FILGUEIRAS), SICILIANO, FULVIO (SICILIANO, FULVIO), ARANAS, CLODUALDO (ARANAS, CLODUALDO), SILVA, EDEN SANTOS (SILVA, EDEN SANTOS), Gedeon Silva Reis (REIS, GEDEON SILVA), JONAS, JOHN JOSEPH (JONAS, JOHN JOSEPH)",A4
3630171389708262,25042024,Artigo Publicado,Optimization of Thermomechanical Processing under Double-Pass Hot Compression Tests of a High Nb and N-Bearing Austenitic Stainless-Steel Biomaterial Using Artificial Neural Networks,2022.0,,,,Metals,,,"SULZBACH, GLÁUCIA ADRIANE DE S. (SULZBACH, GLÁUCIA ADRIANE DE S.), ABREU, HAMILTON F. GOMES DE (ABREU, HAMILTON F. GOMES DE), Gedeon Silva Reis (REIS, GEDEON S.), SILVA, EDEN S. (SILVA, EDEN S.), RODRIGUES, MARIA VERÔNICA G. (RODRIGUES, MARIA VERÔNICA G.), RODRIGUES, SAMUEL F. (RODRIGUES, SAMUEL F.), LIMA, MARCOS NATAN DA S. (LIMA, MARCOS NATAN DA S.), LOUREIRO, RODRIGO DE C. PAES (LOUREIRO, RODRIGO DE C. PAES), SÁ, DENIS FABRÍCIO S. DE (SÁ, DENIS FABRÍCIO S. DE), ARANAS, CLODUALDO (ARANAS, CLODUALDO), MACEDO, GLAUCIA MARIA E. (MACEDO, GLAUCIA MARIA E.), SICILIANO, FULVIO (SICILIANO, FULVIO)",A2
9170200225511874,29042024,Artigo Publicado,BIOPROSPECTION OF MANGABA (HANCORNIA SPECIOSA Gomes) NATIVE IN THE TRANSITION REGION SAVANNA-RESTINGA,2020.0,,,,INTERNATIONAL JOURNAL OF DEVELOPMENT RESEARCH,,,"Georgiana Eurides de Carvalho Marques (Marques, Georgiana Eurides de Carvalho), Clenilma Marques Brandão (BRANDAO, C. M.), Djanira Rubim dos Santos (SANTOS, D. R.), Juliane Cutrim Marques (MARQUES, J. C.)",A1
9170200225511874,29042024,Artigo Publicado,A Extensão Universitária no Cenário Atual da Pandemia do COVID-19,2020.0,,,,REVISTA PRÁTICAS EM EXTENSÃO,,,"Georgiana Eurides de Carvalho Marques (Marques, Georgiana Eurides de Carvalho)",B2
9170200225511874,29042024,Artigo Publicado,"Ditos do Jatobá: desmatamento e falta de conservação de uma espécie nativa na visão de moradores da comunidade quilombola Damásio em Guimarães, Maranhão, Brasil",2020.0,,,,Cadernos Agroecológicos,,,"Ricardo Santos Avelar (AVELAR, R. S.), Georgiana Eurides de Carvalho Marques (Marques, Georgiana Eurides de Carvalho), Clenilma Marques Brandão (BRANDAO, C. M.)",B2
9170200225511874,29042024,Artigo Publicado,Formulação de Hidratante com Extratos de Humiria balsamifera (Aubl A. St. Hil) com Ação Antioxidante,2020.0,,,,Cadernos Agroecológicos,,,"Suzana dos Anjos Paz (PAZ, S. A.), Georgiana Eurides de Carvalho Marques (Marques, Georgiana Eurides de Carvalho)",B2
9170200225511874,29042024,Artigo Publicado,"Avaliação do perfil de consumidores e feirantes do Circuito de Feiras Agroecológicas do Baixo Munim, Maranhão, Brasil.",2020.0,,,,Cadernos Agroecológicos,,,"Reinaldo Vinicius Morais Pereira (PEREIRA, R. V. M.), Georgiana Eurides de Carvalho Marques (Marques, Georgiana Eurides de Carvalho), Ellen Cristine Nogueira Nojosa (NOJOSA, E. C. N.)",B2
9170200225511874,29042024,Artigo Publicado,Sabor e saber tradicional em cookies a base da farinha de Jatobá (Hymenaea courbaril L.),2020.0,,,,Cadernos Agroecológicos,,,"Gabryela Diniz Dias (Dias, G. D.), Georgiana Eurides de Carvalho Marques (Marques, Georgiana Eurides de Carvalho), Clenilma Marques Brandão (BRANDAO, C. M.)",B2
9170200225511874,29042024,Artigo Publicado,Juventude e Agroecologia: Uma experiência de formação em educação agroecológica para jovens agricultores do Meio-Norte do Brasil,2020.0,,,,Cadernos Agroecológicos,,,"Camila Nunes Santos Lima (CAMILA NUNES SANTOS LIMA,), Alice Maria Pinto Pinheiro (PINHEIRO, A. M. P.), warmiston carvalho (CARVALHO, W.), Georgiana Eurides de Carvalho Marques (Marques, Georgiana Eurides de Carvalho), Roberta Almeida Muniz (MUNIZ, R. A.), Vivian do Carmo Loch (LOCH, V. C.)",B2
9170200225511874,29042024,Artigo Publicado,"Composition and Larvicidal Activity of the Oil of Dizygostemon riparius</i> (Plantaginaceae), a New Aromatic Species Occurring in Maranhão, Brazil",2020.0,,,,CHEMISTRY & BIODIVERSITY,,,"BRANDÃO, CLENILMA M. (BRANDÃO, CLENILMA M.), CAVALCANTE, KIANY SIRLEY B. (CAVALCANTE, KIANY SIRLEY B.), M. TELES, ROGÉRIO (M. TELES, ROGÉRIO), Georgiana Eurides de Carvalho Marques (C. MARQUES, GEORGIANA E.), MONTEIRO, ODAIR S. (MONTEIRO, ODAIR S.), ANDRADE, ELOISA HELENA A. (ANDRADE, ELOISA HELENA A.), MAIA, JOSÉ GUILHERME S. (MAIA, JOSÉ GUILHERME S.)",B2
9170200225511874,29042024,Artigo Publicado,ALIMENTAÇÃO SAUDÁVEL: Integração da escola para a promoção da alimentação alternativa em uma escola pública de São Luís - MA,2021.0,,,,ACTA TECNOLÓGICA,,,"Georgiana Eurides de Carvalho Marques (De Carvalho Marques, Georgiana Eurides), SOARES, DAYANE CRISTINA COSTA (SOARES, DAYANE CRISTINA COSTA)",B4
9170200225511874,29042024,Artigo Publicado,Characterization of vegetation structure in areas of natural occurrence of  Hancornia speciosa Gomes,2021.0,,,,AUSTRALIAN JOURNAL OF CROP SCIENCE (ONLINE),,,"Régilla Martins dos Reis (REIS, R. M.), Ariadne Enes Rocha (ROCHA, A. E.), Mary Jane Nunes Carvalho (CARVALHO, M. J. N.), Larissa de Paula Viana da  Silva (SILVA, L. P. V.), Francisca Helena Muniz (MUNIZ, F. H.), Georgiana Eurides de Carvalho Marques (Marques, Georgiana Eurides de Carvalho), Mário Luiz Ribeiro Mesquita (MESQUITA, M. L. R.)",B4
9170200225511874,29042024,Artigo Publicado,BIOMASS REDUCTION OF ORGANIC MATERIALS IN A DOMESTIC COMPOSTING SYSTEM,2021.0,,,,BIOFIX SCIENTIFIC JOURNAL (ONLINE),,,"Osmar Luis Vasconcelos (VASCONCELOS, O. L.), Laiza Moraes Carneiro (CARNEIRO, L. M.), Georgiana Eurides de Carvalho Marques (Marques, Georgiana Eurides de Carvalho), Ellen Cristine Nogueira Nojosa (NOJOSA, E. C. N.), Rodrigo Barbosa Lorena (LORENA, R. B.)",A1
9170200225511874,29042024,Artigo Publicado,HORTA ESCOLAR AGROECOLÓGICA: DINAMIZANDO O PROCESSO DE ENSINOAPRENDIZAGEM PARA RESGATE DOS VALORES TRA,2021.0,,,,INTERNATIONAL JOURNAL OF DEVELOPMENT RESEARCH,,,"Ellen Cristine Nogueira Nojosa (NOJOSA, E. C. N.), Osmar Luis Vasconcelos (VASCONCELOS, O. L.), Georgiana Eurides de Carvalho Marques (Carvalho Marques, Georgiana Eurides de), Djanira Rubim dos Santos (SANTOS, D. R.), Roberta Almeida Muniz (MUNIZ, R. A.), Kathlen H. S. Nunes (NUNES, K. H. S.), Mateus de Jesus Pereira Gama (GAMA, M. J. P.)",A1
9170200225511874,29042024,Artigo Publicado,EDUCAÇÃO AMBIENTAL NO MEIO RURAL: ESTUDO DE PRÁTICAS AMBIENTAIS EM ESCOLAS DE ENSINO FUNDAMENTAL NA I LHA DE SÃO LUÍS,2021.0,,,,Brazilian Journal of Agroecology and Sustainability,,,"Georgiana Eurides de Carvalho Marques (Marques, Georgiana Eurides de Carvalho), Camilla Bezerra Ferreira de Souza (SOUZA, C. B. F.), Leandro Coelho Moura (MOURA, L. C.)",A2
9170200225511874,29042024,Artigo Publicado,"Plantas não convencionais para fins alimentares comercializadas em feiras de São Luís, Maranhão",2021.0,,,,REVISTA VERDE DE AGROECOLOGIA E DESENVOLVIMENTO SUSTENTÁVEL,,,"Georgiana Eurides de Carvalho Marques (Marques, Georgiana Eurides de Carvalho), SANTOS, YANKA AZEVEDO (SANTOS, YANKA AZEVEDO), PINHEIRO, ALICE MARIA PINTO (PINHEIRO, ALICE MARIA PINTO), MUNIZ, ROBERTA ALMEIDA (MUNIZ, ROBERTA ALMEIDA), Vasconcelos, Osmar Luis Silva (Vasconcelos, Osmar Luis Silva), SANTOS, DJANIRA RUBIM DOS (SANTOS, DJANIRA RUBIM DOS)",B1
9170200225511874,29042024,Artigo Publicado,Métodos de compostagem doméstica de materiais orgânicos produzidos em ambiente urbano / Domestic composting methods of organic materials produced in urban environment,2021.0,,,,Brazilian Journal of Development,,,"Vasconcelos, Osmar Luis Silva (Vasconcelos, Osmar Luis Silva), Georgiana Eurides de Carvalho Marques (Marques, Georgiana Eurides de Carvalho), Lorena, Rodrigo Barbosa (Lorena, Rodrigo Barbosa), Nojosa, Ellen Cristine Nogueira (Nojosa, Ellen Cristine Nogueira)",B4
9170200225511874,29042024,Artigo Publicado,Perfil comparativo da eficácia antibacteriana de desinfetantes caseiros e comerciais vendidos em São Luís - MA / Comparative profile of the antibacterial efficacy of home and commercial disinfectants sold in São Luís - MA,2021.0,,,,Brazilian Journal of Development,,,"RODRIGUES, FREDSON COSTA (RODRIGUES, FREDSON COSTA), OLIVEIRA, JONAS MAURÍCIO BERTOLDO (OLIVEIRA, JONAS MAURÍCIO BERTOLDO), JUNIOR, LUIZ CARLOS ROCHA (JUNIOR, LUIZ CARLOS ROCHA), Georgiana Eurides de Carvalho Marques (Marques, Georgiana Eurides de Carvalho), CAMARA, MARCOS BISPO PINHEIRO (CAMARA, MARCOS BISPO PINHEIRO), PRADO, ÂNGELA ARAÚJO (PRADO, ÂNGELA ARAÚJO), MORAES, FRANCYELLE COSTA (MORAES, FRANCYELLE COSTA)",B4
9170200225511874,29042024,Artigo Publicado,"Hancornia speciosa Gomes: caracterização química, compostos bioativos e atividade antioxidante",2022.0,,,,Brazilian Journal of Development,,,"MARIA EDUARDA COUTINHO DA SILVA (SILVA, M. E. C.), Eshylley Braenne Santos Santos (SANTOS, E. B. S.), Georgiana Eurides de Carvalho Marques (Marques, Georgiana Eurides de Carvalho), Clenilma Marques Brandão (BRANDAO, C. M.), Daniely Veronica Viana Cardoso (CARDOSO, D. V. V.), Bruno de Araujo Gomes (GOMES, B. A.), Flávia de Aquino Cutrim (CUTRIM, F. A.), Djanira dos Santos Rubim (RUBIM, D. S.), Osmar Luis Vasconcelos (VASCONCELOS, O. L.)",B4
9170200225511874,29042024,Artigo Publicado,Desafios dos professores da EPTT no desenvolvimento da educação remota em tempos de pandemia,2022.0,,,,"RESEARCH, SOCIETY AND DEVELOPMENT",,,"Georgiana Eurides de Carvalho Marques (Marques, Georgiana Eurides de Carvalho), LOPES, MURANNA SILVA (LOPES, MURANNA SILVA), CARVALHO, EDSON MAURO VIANA DE (CARVALHO, EDSON MAURO VIANA DE)",B4
